Χρονική σήμανση,Όνομα Επιχείρησης (title),Ημερομηνία Δραστηριότητας (date),Τοποθεσία (location),Περιγραφή (description),URL Εικόνας (image),Τοποθεσία (Google Maps URL),Τοποθεσία (coondinates)
,"Ξενάγηση στη Δημόσια Ιστορική Βιβλιοθήκη",12/07/2026,"'Αγιος Γεώργιος, Ζαγορά","Ξενάγηση στην Ιστορική Βιβλιοθήκη και στα σπάνια χειρόγραφα βιβλία της.",photos/bibliothiki.jpg,https://maps.app.goo.gl/u9r87gPHgBPqbu1o6,"39.4418, 23.1029"
,"Ξενάγηση στo Aγροτικό Συνεταιρισμό",06/06/2026,"Ψυκτικές εγκαταστάσεις Συνεταιρισμού","Ξενάγηση στις εγαταστάσεις του συνετερισμού και παρακολούθηση της διαδικασίας επεξεργασίας του μήλου.",photos/Zagorin-apples.png,https://maps.app.goo.gl/jb1cyptJqHKMRaHM8,"39.4444, 23.117"
,"Προβολή Ντοκιμαντερ της ιστορίας του τόπου",22/06/2026,"Project Z, Ζαγορά","Παρουσίαση ντοκιμαντέρ που αναδεικνύει την ιστορία, την πολιτιστική κληρονομιά και τις σημαντικότερες στιγμές του τόπου.",photos/project.jpg,https://maps.app.goo.gl/64o5bv97C4GjHx5r5,"39.4429, 23.1026"
,"Μαθήματα μαγειρικής στο Γυναικείο Συνεταιρισμό",19/08/2026,"Αρχοντικό Δρακοπούλου, Ζαγορά","Οι γυναίκες του συνεταιρισμού θα σας δείξουν πώς φτιάχνουν παραδοσιακές μαρμελάδες και γλυκά του κουταλιού, μοιράζοντας μαζί σας τα μυστικά και τις συνταγές τους.",photos/sweets.png,https://maps.app.goo.gl/Jm8V5NsP4BPa9NGy5,"39.4444, 23.1027"
,"Γαστρονομικό Φεστιβάλ",10/08/2026,"Πλατεία Αγίας Κυριακής, Ζαγορά","Mια γιορτή γεύσεων και παραδόσεων.",photos/festival.jpg,https://maps.app.goo.gl/ixQwx9sTHBdy17iJ6,"39.4395, 23.1033"
